{"type":"utterance","v":3,"src":"laptop","t":1760000000.45,"utt_id":"u-0192","t_start":1760000000.08,"t_end":1760000000.45,"text":"did you see","pending":"the email","final":false,"bearing_deg":38.9,"bearing_spread_deg":4.1,"source_id":0,"overlap":false,"tone":"excited","tone_confidence":0.7,"loudness":0.55,"engine":"faster_whisper"}
